<?xml version="1.0" encoding="UTF-8"?>
<breakdown xmlns:xsi="http://www.w3.org/2001/XMLSchema-instance" xsi:noNamespaceSchemaLocation="../dtd/servicebreakdown.xsd">
  <service>
    <specification>Example Service 1: set duration in days and with hourly rate.</specification>
    <effort in="days">2</effort>
    <hourly_rate>10</hourly_rate>
    <fee denomination="eur">
      <computed/>
    </fee>
  </service>
  <service>
    <specification>Example Service 2: variable duration with min/max parameters and with hourly
      rate.</specification>
    <effort in="days">
      <min>3</min>
      <max>4</max>
    </effort>
    <hourly_rate>10</hourly_rate>
    <fee denomination="eur">
      <computed/>
    </fee>
  </service>
  <service>
    <specification>Example Service 3: set duration in days with CUSTOM (non-computed) set
      fee.</specification>
    <effort in="days">5</effort>
    <fee denomination="eur">500</fee>
  </service>
  <service>
    <specification>Example Service 4: set duration in hours with CUSTOM (non-computed) variable fee
      (min/max).</specification>
    <effort in="hours">4</effort>
    <fee denomination="eur">
      <min>100</min>
      <max>200</max>
    </fee>
  </service>
  <service>
    <specification>Example Service 5: set duration in days with CUSTOM (non-computed) estimated
      fee.</specification>
    <effort in="hours">4</effort>
    <fee denomination="eur" estimate="yes">1000</fee>
  </service>
  <service optional="yes">
    <specification>Example Service 6: optional service</specification>
    <effort in="days">
      <min>1</min>
      <max>2</max>
    </effort>
    <hourly_rate>50</hourly_rate>
    <fee denomination="eur">
      <computed/>
    </fee>
  </service>
  <extra>
    <specification>Example Extra Cost 1: set fee</specification>
    <fee denomination="eur">1000</fee>
  </extra>
  <extra>
    <specification>Example Extra Cost 2: variable min/max fee</specification>
    <fee denomination="eur">
      <min>1000</min>
      <max>1200</max>
    </fee>
  </extra>
  <extra>
    <specification>Example Extra Cost 3: estimated fee</specification>
    <fee denomination="eur" estimate="yes">600</fee>
  </extra>
  <extra>
    <specification>Example Extra Cost 4: with duration</specification>
    <effort in="days">6</effort>
    <fee denomination="eur">600</fee>
  </extra>
</breakdown>
